{
  "task_id": "20260209T085713Z_prl_stage_demo",
  "skill": "prl_writer",
  "input_paper_root": "USER/paper",
  "shadow_root": "AGENTS/tasks/20260209T085713Z_prl_stage_demo/work/paper_shadow/paper",
  "edited_files": [],
  "build_checks": [
    {
      "name": "latexmk",
      "cmd": "latexmk -pdf main.tex",
      "status": "skipped",
      "log_path": "AGENTS/tasks/20260209T085713Z_prl_stage_demo/logs/latexmk.log"
    }
  ],
  "notes": "Placeholder mode: no edits applied (main.tex missing or already marked)."
}
